{"contracts":{"allocation":"1.0.0","build-flags":"1.0.0","diagnostics":"1.0.0","lifecycle":"1.0.0","platform":"1.0.0"},"format":"automap-lock/1","lock_hash":"sha256:a5017d629198ad6cdc43eff4b01419869f5c584b2a3bccbc0d6d720d78341f47","map_release":"unreleased","pins":{"stub-ui":{"commit":"2222222222222222222222222222222222222222","content_hash":"sha512:00000000000000000000000000000000000000000000000000000000000000000000000000000000000000000000000000000000000000000000000000000002","license":"MIT-0","registry":{"commit":"3333333333333333333333333333333333333333","kind":"automap"},"variant":"default","version":"1.0.0"},"stub-window":{"commit":"1111111111111111111111111111111111111111","content_hash":"sha512:00000000000000000000000000000000000000000000000000000000000000000000000000000000000000000000000000000000000000000000000000000001","license":"MIT-0","registry":{"commit":"3333333333333333333333333333333333333333","kind":"automap"},"variant":"default","version":"1.0.0"}}}