{"contracts":{"allocation":"1.0.0","build-flags":"1.0.0","diagnostics":"1.0.0","jobs":"1.0.0","lifecycle":"1.0.0","math-types":"1.0.0","platform":"1.0.0"},"format":"automap-lock/1","lock_hash":"sha256:63bcf6388baca004f247a9337e8852800ae60fab17bc7158d4e57cf3a74ca4c0","map_release":"map-2026.10.29","pins":{"dear-imgui":{"commit":"b916186e66aa3c02b72c6ca17455516512ed8049","content_hash":"sha512:00ade7a3e2c2e34465f1bb9fafd78733d3e659617b0857cf1b3c7f04cfc1d8566d1fd6a8697946f0de7c808cce1c4d0a4b2195c7bc20144cfd8b1e9b1cfba621","license":"MIT","registry":{"commit":"d186940b2f0c4e8e5b4ff804af57d2a26fbfa091","kind":"vcpkg-curated"},"variant":"docking","version":"1.93.0"},"jolt":{"commit":"e77f175595e64cb44218cc9d9d56fc365ad0e36a","content_hash":"sha512:bc6f2436bef91a6ffd09eee98186be645f6e9a9b3f65a7a645abf00432ac40ada03320c1fe946661817a94eda372cf8d88e4889991cdd25f1c16ecf9a4486677","license":"MIT","registry":{"commit":"d186940b2f0c4e8e5b4ff804af57d2a26fbfa091","kind":"vcpkg-curated"},"variant":"default","version":"5.6.0"},"sdl3":{"commit":"829a65d769d935c4852f8159e964312c0957260a","content_hash":"sha512:12fcb5592016b27922b08d1580d75f5f15c72e67cf04415e2bd824dc7563ac940c25bbe368b03d0a755f5832803049467e3d0ee6784ed3684792bc4d7741af50","license":"Zlib","registry":{"commit":"d186940b2f0c4e8e5b4ff804af57d2a26fbfa091","kind":"vcpkg-curated"},"variant":"default","version":"3.4.18"}}}